{
  "v": "ACDC10JSON000abc_",
  "d": "EConnectionCredAtoB1234567890123456789_",
  "u": "0AConnectionNonceGHI789",
  "i": "EAdminAIDabcdefghijklmnopqrstuvwxyz1234_",
  "ri": "ERegistryAIDabcdefghijklmnopqrstuvwxy1_",
  "s": "EWireguardConnectionCredentialSchemaV1_0_0",
  "a": {
    "d": "EAttrBlockSAIDConnection1234567890123_",
    "u": "0AAttrNonceConnection1",
    "i": "EHostAAIDabcdefghijklmnopqrstuvwxyz123_",
    "dt": "2026-05-18T15:31:00.000Z"
  },
  "e": {
    "d": "EEdgeBlockSAIDConnection1234567890123456_",
    "peer1": {
      "n": "EHostAInterfaceCredSAIDxyz1234567890123_",
      "s": "EJhuwoliTRahBQTHyfvIROkMh6_goGAqduSsNvSD-Wco",
      "o": "NI2I",
      "endpoint": "hosta.example.com:51820",
      "allowedIps": ["10.0.0.1/32"],
      "connectionMetadata": {
        "connectionName": "hosta",
        "environment": "production"
      }
    },
    "peer2": {
      "n": "EHostBInterfaceCredSAIDxyz9876543210987_",
      "s": "EJhuwoliTRahBQTHyfvIROkMh6_goGAqduSsNvSD-Wco",
      "o": "NI2I",
      "endpoint": "hostb.example.com:51820",
      "allowedIps": ["10.0.0.2/32"],
      "persistentKeepalive": 25,
      "connectionMetadata": {
        "connectionName": "hostb",
        "purpose": "Secure backend communication from Host A to Host B",
        "environment": "production",
        "bandwidthClass": "high"
      }
    }
  }
}
